{
  "schema_version": "1.1.0",
  "type": "Section",
  "variant": "default",
  "id": "sales-section",
  "props": {
    "title": "Ventes"
  },
  "children": [
    {
      "schema_version": "1.1.0",
      "type": "Row",
      "props": {},
      "children": [
        {
          "schema_version": "1.1.0",
          "type": "KPICard",
          "variant": "compact",
          "props": {
            "label": "CA",
            "value": 125000
          }
        },
        {
          "schema_version": "1.1.0",
          "type": "KPICard",
          "variant": "compact",
          "props": {
            "label": "Ventes",
            "value": 42
          }
        }
      ]
    },
    {
      "schema_version": "1.1.0",
      "type": "DataTable",
      "props": {
        "columns": ["produit", "quantite", "prix"]
      }
    }
  ]
}
